{
  "schema_version": 1,
  "id": "spell.heal",
  "name": "heal",
  "type": "SPELL",
  "level": 1,
  "cost": {
    "mana": 4
  },
  "cooldown": {
    "ticks": 3
  },
  "targeting": "BENEFICIAL",
  "aliases": ["healing"],
  "effects": [
    {
      "kind": "VITALS",
      "stat": "HP",
      "operation": "INCREASE",
      "amount": 6
    }
  ],
  "messages": {
    "self": "You cast {ability} on {target}.",
    "target": "{source} casts {ability} on you.",
    "room": "{source} casts {ability} on {target}."
  }
}
